{
  "schemaVersion": "assist.consultation/1.0",
  "requestID": {"value": "request-001"},
  "localSessionID": {"value": "local-session-001"},
  "transportSessionID": {"value": "session-001"},
  "turnID": {"value": "turn-001"},
  "expectedRevision": 1,
  "locale": "pt-BR",
  "input": {"kind": "user_message", "text": "O que é um ponto de acesso?"},
  "contextSnapshot": {
    "schemaVersion": "assist.consultation/1.0",
    "snapshotID": {"value": "snapshot-001"},
    "revision": 1,
    "purpose": "consultation",
    "intent": "open_question",
    "consent": {
      "ref": {"value": "consent-001"},
      "state": "granted",
      "scope": "question",
      "recordedAt": "2026-10-09T12:00:00Z"
    },
    "consentReceiptRef": {"value": "consent-001"},
    "entities": [],
    "createdAt": "2026-10-09T12:00:00Z",
    "sources": [],
    "capabilities": [],
    "facts": [],
    "hypotheses": [],
    "absences": [],
    "measurements": []
  },
  "consentReceiptRef": {"value": "consent-001"}
}
